id_evento;fecha_evento;fecha_solicitud;nombre;objetivo;riesgos;acciones;observacion
2;2018-07-03;2018-07-03 12:01:24.779-05;prueba;prueba;Ninguno;prueba;
3;2018-07-29;2018-07-04 10:00:56.992-05;Convenio UNAN;Practica de TICS;Ninguno;Exposicion;
4;2018-07-31;2018-07-08 11:58:49.017-05;Reunion de Especialistas;Verificar los conocimientos con respecto a las te;Ninguno;Presentacion de Diapositivas;
5;2018-07-01;2018-07-09 09:37:45.911-05;Capacitaci贸n Vendedores;Capacitar Vendedores;Ninguno;Conferencia;
6;2018-07-31;2018-07-04 10:15:24.589-05;Proteccion Medio Ambiente;Tecnologiasas  protecci贸n ambiente;Ninguno;Proyeccion;
7;2018-07-02;2018-07-09 09:40:51.575-05;Congreso de Auditores;Explicacion de las normas Icontec;Ninguno;Proyeccion;
8;2018-07-08;2018-07-08 14:24:45.342-05;Congreso IEEE;Motivacion al uso de las tecnica IEE;Ninguno;Proyeccion;
9;2018-07-09;2018-07-09 09:43:10.973-05;Congreso de veduria y corrupcion;Detectar modos de corrupcion;Danio de las intalaciones por fuego;Conferencia;El Horario no se encuentra disponible
10;2018-07-31;2018-07-10 11:23:35.385-05;Capacitacion de normas Retie;Prevencion de accidentes en electricidad;Ninguno;Conferencia;El Horario no se encuentra disponible
11;2018-07-31;2018-07-10 11:42:47.452-05;Cocurso de LOL;LLevar a cabo la competencia lol;Ninguno;Comnpetencia;
1;2018-06-26;2018-07-03 11:04:13.808-05;Ingenierrring;Ingenierrring;Ninguno;Ingenierrring;
73;2018-07-01;2018-06-22 16:55:42.406-05;Prueba de Datos;Probar si la informaci贸n de la base de datos es correcta;ninguno;ninguno;""
72;2018-06-30;2018-06-22 16:47:16.695-05;Evento Prueba;Probar la creaci贸n de un solicitante en la base de datos;ninguno;ninguno;""
